<?xml version="1.0" encoding="UTF-8" standalone="yes"?>
<SimEntity extend="SimEntityBase" name="ArrayTester" package="test" version="$Id:$" description="empty" xsi:noNamespaceSchemaLocation="http://eos.nps.edu/Simkit/simkit.xsd" xmlns:xsi="http://www.w3.org/2001/XMLSchema-instance">
    <StateVariable name="sinus" type="double[180]" description="empty">
        <Comment/>
    </StateVariable>
    <Event name="Run" description="empty">
        <Comment/>
        <LocalVariable name="_idxvar_0" type="int" value="0">
            <Comment>used internally</Comment>
        </LocalVariable>
        <StateTransition index="_idxvar_0" state="sinus">
            <Assignment value="Math.sin(2.0*Math.PI*((double)_idxvar_0)/((double)180))"/>
        </StateTransition>
        <Schedule condition="true" delay="0.0" event="DumpArrayElement" priority="0">
            <Comment/>
            <EdgeParameter value="0"/>
        </Schedule>
        <Coordinate x="30" y="30"/>
    </Event>
    <Event name="DumpArrayElement" description="empty">
        <Comment/>
        <Argument name="i" type="int" description="empty"/>
        <LocalVariable name="code" type="boolean" value="true; System.out.println(getSinus(i))">
            <Comment/>
        </LocalVariable>
        <Schedule condition="i&lt;180" delay="0.0" event="DumpArrayElement" priority="0">
            <Comment/>
            <EdgeParameter value="i++"/>
        </Schedule>
        <Code>

System.out.println("Element "+i + " dumped. ");
if ( true ) {
	System.out.println("");
}

	</Code>
        <Coordinate x="200" y="110"/>
    </Event>
</SimEntity>

