<?xml version="1.0" encoding="UTF-8" standalone="yes"?>
<SimEntity name="SimpleInventory" version="0.1" package="examples" description="" xsi:noNamespaceSchemaLocation="http://eos.nps.edu/Simkit/simkit.xsd" xmlns:xsi="http://www.w3.org/2001/XMLSchema-instance">
    <Parameter description="" type="simkit.random.RandomVariate" name="timeBetweenDemands"/>
    <Parameter description="" type="simkit.random.RandomVariate" name="demand"/>
    <Parameter description="" type="simkit.random.RandomVariate" name="leadTime"/>
    <Parameter description="" type="double" name="timeBetweenReviews"/>
    <Parameter description="" type="double" name="initialInventory"/>
    <Parameter description="" type="double" name="triggerPoint"/>
    <Parameter description="" type="double" name="orderUpTo"/>
    <StateVariable description="" name="inventoryPosition" type="double" />
    <StateVariable description="" name="amountOnOrder" type="double" />
    <Event name="Run" description="">
        <StateTransition state="inventoryPosition">
            <Assignment value="initialInventory"/>
        </StateTransition>
        <StateTransition state="amountOnOrder">
            <Assignment value="0"/>
        </StateTransition>
        <Schedule delay="timeBetweenReviews" event="Review"/>
        <Schedule delay="timeBetweenDemands.generate()" event="Demand"/>
        <Coordinate y="20" x="10"/>
    </Event>
    <Event name="Demand" description="">
        <StateTransition state="inventoryPosition">
            <Assignment value="inventoryPosition - demand.generate()"/>
        </StateTransition>
        <Schedule delay="timeBetweenDemands.generate()" event="Demand"/>
        <Coordinate y="20" x="160"/>
    </Event>
    <Event name="Review" description="">
        <Schedule condition="inventoryPosition + amountOnOrder &lt; triggerPoint" delay="0.0" event="PlaceOrder">
            <EdgeParameter value="(orderUpTo - inventoryPosition - amountOnOrder)"/>
        </Schedule>
        <Schedule delay="timeBetweenReviews" event="Review"/>
        <Coordinate y="140" x="80"/>
    </Event>
    <Event name="PlaceOrder" description="">
        <Argument description="" name="newOrderAmount" type="double"/>
        <StateTransition state="amountOnOrder">
            <Assignment value="amountOnOrder + newOrderAmount"/>
        </StateTransition>
        <Schedule delay="leadTime.generate()" event="ReceiveOrder">
            <EdgeParameter value="newOrderAmount"/>
        </Schedule>
        <Coordinate y="150" x="190"/>
    </Event>
    <Event name="ReceiveOrder" description="">
        <Argument description="" name="receivedOrderAmount" type="double"/>
        <StateTransition state="amountOnOrder">
            <Assignment value="amountOnOrder - receivedOrderAmount"/>
        </StateTransition>
        <StateTransition state="inventoryPosition">
            <Assignment value="inventoryPosition + receivedOrderAmount"/>
        </StateTransition>
        <Coordinate y="150" x="310"/>
    </Event>
</SimEntity>

